scrape_datetime,jk,job_title,company,job_location,post_datetime,job_description
2017-12-14 09:04:39.667183,e179354445c01beb,Data Scientist / Data Analyst,GOGO TECH LIMITED,Hong Kong,2 days ago,"Established in 2013, GOGOVAN is the first app-based platform for transporting goods in Asia, which is dedicated in offering excellent transportations and logistics system through innovative technology. The GOGOVAN app was created to connect individuals and businesses directly to thousands of drivers for their real-time logistic needs, and to redefine the everyday logistics experience by providing a convenient and efficient service. Over the years, GOGOVAN has expanded its business from Hong Kong to Singapore, South Korea, Mainland China, Taiwan and India and will continue to expand globally."
2017-12-14 09:04:39.540835,bc823cab7ae936a6,Data Scientist,Gorilla Group Ltd.,Hong Kong,,"Gorilla Group LTD revitalises the industry with the development of the most advanced mobile queuing application ""THE GULU"" (former name is ""FOOD GULU"").http://www.thegulu.com
THE GULU is a multi-function mobile app, enabling users to remote queue, make reservations, order takeaway with payment, banquet/party booking, e-coupons all inREALTIME.
In addition to the F&B; industry, THE GULU also provides services for other industries as well.
To cope with our rapid expansion in 2017, we are NOW providing an exciting and rewarding career at THE GULU with the following position:"
2017-12-14 09:04:39.916313,93c4b0bd3a87d708,Investment Research Scientist,,Hong Kong,,"My client is a leading US-based quantitative hedge fund with a global reach that is actively looking to build up their operations in Asia.
The firm has built up market data feed handlers, a world-class execution management platform, plus can offer a profit-share agreement to anyone successfully hired. There is also the possibility of working remotely in certain circumstances.
Currently they are looking to hire a number of Investment Research Scientists who will build, run & optimise equity and cross-asset futures portfolios. These can be both medium and high frequency in nature. Havinga performance track record and coding abilities are key.
This is an excellent opportunity to join one of the world's leading quant hedge funds and improve upon your existing alpha models."
2017-12-14 09:04:19.182590,79e017be001a79f9,Data Scientist - Hang Seng Bank (HK),HSBC,"Central, Hong Kong Island",13 days ago,"A Career with Hang Seng Bank
"
2017-12-14 09:04:19.344836,d8e8ce1253c50cf2,Data Scientist,9GAG,Hong Kong,30+ days ago,"ResponsibilitiesAble to work independently with minimal supervision and support.Identify and execute on high impact projects. Projects can range from developing customer retention models or developing a recommendation engine.Collaborate with Web and Data Engineers to build and maintain robust and scalable data reporting and analytics infrastructure and models while proactively surfacing opportunities.Provide deep performance analysis to extrapolate current and historical trends into forecasts, and provide business context to identify and drive critical growth initiatives, from product features to revenue model.Demonstrate the ability to influence outcomes and decisions (not just report on analysis)Be a champion for high quality data-driven decision-making throughout the company by helping other teams develop good metrics and their own data analysis skills.RequirementsLive our values - H2O: Hustle to go all-in to achieve the goal, work hard and work smart; Humble to embrace the better ideas of others; Open to welcome differences and possibilities.BA/BS in Computer Science, Machine Learning, Math, Engineering, Statistics or other technical field. Advanced degrees preferred.Solid knowledge of statistics.Banking/finance/e-commerce or strategy consulting with a focus on technology and/or media is highly desirable.Fluency in SQL, R or experience with at least one programming language (Python, Scala)Hands-on experience with Spark, Hadoop, etc.Ability to design, lead and execute analysis and effectively communicate insights, ideas and conclusions clearly to team members across the organization, technical and nontechnical alike.Highly motivated, and able to think clearly under pressure.Excellent communication skills.Real-world experience in machine learning, data mining and NLP to surface valuable insights in our dataset. (Bonus).You can teach us something new! We love to hire people who are way more knowledgeable than us in some area and can be good teachers and mentors.Latent interest and passion on social media platforms and product trends.No haters!DesiredActive user of 9GAG.To Applyhttps://9gag.com/jobsJob Type: Full-time"
2017-12-14 09:04:19.506216,09a1cdff93c2fa8a,Junior Data Scientist - Quantitative Trading,Aoling Investments,"Wong Tai Sin, Kowloon",30+ days ago,"A small proprietary trading firm based in HK specialised in high frequency trading and quantitative trading is looking for talents to expand its quantitative research team.MS or PhD candidates in quantitative disciplineStrong statistical and mathematical modeling skillAbility to write R/Python, skillful in Excel/VBAInterested candidates please apply via APPLY NOW .Job Type: Full-time"
2017-12-14 09:04:19.637177,5ac229c76497d8e5,Data Scientist,AUREXIA Consulting,Hong Kong,21 days ago,"Aurexia is a European and Asian based business consulting boutique dedicated solely to the financial service industry. We deliver innovative solutions in all financial areas: CIB, Asset Management Securities Services, Wealth Management/Private banking and Finance and Risk.


Utilising our business expertise, quality and creativity we partner with clients to solve their most complex problems, delivering their highest priority and strategic initiatives.


Priding ourselves on forcing our clients to think differently about their business and their most significant issues, as a result helping them successfully increase revenue, manage risk and regulatory change, reduce costs and enhance control


At Aurexia, we believe that we all develop faster when working together as an integrated team including clients for this reason collaboration and knowledge sharing are key cornerstones of our principles. We are also conscious that it takes more than exciting and challenging projects to keep our people happy and stimulated at work. That’s why we are constantly investing in our culture; working at Aurexia you will get a unique opportunity to participate in our internal life and make a real difference in our development. We strive to find the right balance for our people in order to deliver excellent client services while enabling you to carve out your career without giving up your personal priorities.


We are growing fast and are looking for like minded people to come and join us on the journey.


What you will be doing as a Data Scientist :

Design and create complex algorithms, build models, and prototype solutions for multiple projects and stakeholders within a global organisation working towards business and consumer insight
You will work closely with a small team recently brought together to bring inhouse the consumer insight analytics.
You will be versed in using machine learning and large-scale data mining techniques to discover and identify actionable patterns in data and develop hypotheses and models
You will help design hypothesis tests, oversee execution, and perform rigorous statistical evaluation of the results to produce actionable insights
Manage stakeholders and guide them in unlocking the value in their data
You should champion the scientific method and strive for excellence in results at all times, balanced with working in an ‘Agile’ way to achieve rapid turnaround
Required experience:

Demonstrated experience using technology such as R, Python or similar to analyse, transform and visualize big data
Ability to build models (such as linear regression, logistic, Markov models etc.) and use machine learning techniques
Focus, resilience and a passion for problem solving. Able to easily continue to find solutions and work towards goals when setbacks occur
Strong knowledge of data/analytical tools, including Excel, database querying (SQL), relational databases; aptitude and willingness to learn new tools quickly
Hands-on use of big data in large and complex projects using Hadoop, Spark would be a plus
Work Experience and Education Guidelines:

Degree in Statistics, Mathematics, Data Science, Engineering, Economics, or similar
Experience in a role focused on statistical modelling, econometrics, marketing attribution, data science or similar
Passionate about data, models and visualizations
Excellent problem-solving skills, self-motivated with the capacity to work under pressure and tight deadlines
Previous experience with SAS a big plus"
2017-12-14 09:04:19.772500,fa611f4e94d101c8,Data Scientist,Classy Wheeler,"Sheung Wan, Hong Kong Island",30+ days ago,"Client Description

US-based IT service vendor


Job Description

• Degree in Computer Science, Statistics, Applied Math or related field 8+ year experience in data mining and statistical analysis Able to understand various data structures and common methods in data transformation Excellent pattern recognition and predictive modeling skills Experience with programming languages such as R/Python etc.

• Research and develop statistical learning models for data analysis Collaborate with product management and engineering departments to understand company needs and devise possible solutions Communicate results and ideas to key decision makers Implement new statistical or other mathematical methodologies as needed for specific models or analysis Optimize joint development efforts through appropriate database use and project design Proficient in Cantonese & English"
2017-12-14 09:04:19.903567,2b9e6c6394dc66a3,Data Scientist 分析專員,Hong Kong Air Cargo Terminals - HACTL,Hong Kong,19 days ago,"Duties
"
2017-12-14 09:04:20.042247,2fec2995624125da,Data Scientist / Computational Scientist,Cluster Technology Ltd,Hong Kong,30+ days ago,"Solving practical problems by using computational skills and cross-category approaches of data mining/statistics/artificial intelligence/mathematical optimization;

Utilize user characteristics and behavior data, financial data to do data mining and model building analysis;

Participate in client research to collect users’ need, prepare reports of clients’ behavior analysis;

Be required to travel to mainland on a need basis.

Requirements

Major in Computer Science, Engineering, Statistics or related disciplines;

1-2 years hands on relevant working experience;

Good at analytical thinking with solid mathematics knowledge;

Good master of foundation theories and approaches of data mining or statistics field;

Proficiency in Java, Python, R or at least one programming language;

Knowledge on data structure and algorithm;

Experience on processing mass data, model building, and product improvement by mathematical approach is preferable;

Knowledge on MYSQL,ORACLE database operation with excellent tuning skills is an advantage;

Knowledge on machine learning or statistics field with experience on data mining projects is preferred;

Team spirit, proactive in idea sharing with good communication skills (Chinese and English);

Preference will be given to candidates with high integrity, team spirit, strong sense of responsibility, and passion for the application of modern computing technology in China.

Basic Benefits

Benefits & Job application method - 香港 Hong Kong HK

We offer competitive remuneration package including 5-day work and 15 days annual leave to the right candidate with excellent career advancement.

Application Method:
Interested parties please apply with detailed resume (in MS Word / PDF Format), stating current and expected salary to recruit@clustertech.com , or post to:

The Human Resources Department,

Units 211-213, Lakeside 1,

No. 8 Science Park West Avenue,

Hong Kong Science Park,

Shatin, New Territories, Hong Kong

All applications will be treated in strict confidence. Personal information collected will be used solely for the purpose of recruitment. If you are not invited for an interview within 4 weeks, your application will be filed for a further 2 years and be considered for any other appropriate positions within the company or related companies."
2017-12-14 09:04:20.194360,da3aa520ecd7ec79,Data Scientist @ T1,Terminal 1,Hong Kong,10 days ago,"Job Summary!! Apply at: tty1.us/tty1-indeed !!We are Terminal 1 , a recruiting technology firm that hires software builders to both recruit and build automated recruitment tools. Our recruiters are highly skilled software engineers, product designers, and data scientists with strong technical skills and a network in their industry.As a Data Scientist you will be responsible for analytics pipeline from data extraction and processing to model creation and result visualization. You would work on candidate-employee matching algorithms, feature engineering and actionable insights generation.You’ll be working closely with our engineering and product teams to ensure quality of the product and system reliability.Hard Requirements:Hands on experience with machine learning models using Python or R .Experience with one of the following tools: XGboost , Torch7 , Tensorflow .Data visualization skills: Tableau , ggplot , plotly , d3.jsBachelor degree in Computer Science, Mathematics, Engineering or Physics.Fluency in English - you’re going to be in an international and global team.Kaggle Expert rank or above.Soft Requirements:Good theoretical knowledge of algorithms, statistics and optimization methods.A positive attitude and good cultural fit with our team.Experience with distributed infrastructure tools: Apache Spark and one of Hive, Drill or HawkAn awesome portfolio or track record in Github. We do not care about previous experience, as long as you can show us what you can do.!! Apply at: tty1.us/tty1-indeed !!Job Type: Full-time"
2017-12-14 09:04:20.336976,3ce4726440030fe1,Data Scientist,Hang Seng Bank,Hong Kong,30+ days ago,"Digital Banking
"
2017-12-14 09:04:20.499726,00e674cd0b97b165,"Data Scientist in Big Data Technologies, Advanced Business A...",BASF Asia Pacific,Hong Kong,30+ days ago,"Job Field: Information Technology/Service
Location: Hong Kong, HK
Company: BASF Asia Pacific
Job Type: Experienced
Job ID: EN_HK_24826

We are the world's leading chemical company because we offer intelligent solutions for our customers and for a sustainable future. We have over 110,000 employees connecting around the world. For you, this means an almost unlimited range of job opportunities, career development and lots of potential to continue learning . At BASF we believe strongly in the power of connected minds.
Description
Located in Hong Kong, BASF’s regional headquarters oversees more than 16,000 employees at about 100 sites across Asia Pacific. In addition to regional business units, Hong Kong office also houses regional functional units including Corporate Affairs, Finance and Controlling, Human Resources, Management Consulting, Procurement and Supply Chain Services. Objectives of the Position
As a data scientist with strong background in analytics-relevant information technology, the incumbent will:
act as an internal software developer in business and data analytics
be responsible for leading, executing and coordinating innovative data analytics projects and establishing sustainable IT solutions including data modelling and user interface creation
communicate the ideas and solutions to a broad community of non-data scientists Job Responsibilities
Initiate and drive new and ground-breaking development of customized business and data analytics solutions with the highest technical standards and liaise within the Advanced Business Analytics team and the global BASF community
Transfer innovative solutions from a piloting phase into a sustainable and scalable software solution for global and cross-business usage
Liaise with internal business and corporate units and translate their analytical needs into initiatives
Mentor and coach other team members and support their functions by providing expertise and insights into data and computer science Requirements
Holder of Master degree in Computer Science, Data Science, Information Systems; or Bachelor degree with additional years of relevant work experience in the industrial sector
3 to 5 years working experience with databases and SQL, SAP applications and analytics tools like SAP HANA, data warehousing, data management and Big Data technologies as well as lifecycle management of software solutions. Be able to write production-level code
Have a deep understanding of one or more of the following areas: Hadoop (HDFS, MapReduce, Hive, Yarn, Flume, Storm), Spark, Kafka, ActiveMQ
Have superior understanding of internal and external data needs in industrial business processes
Experienced in working in a diverse and global team, with a consultancy and result-oriented mindset, and enjoy working in a newly set-up team
Be able to communicate ideas and solutions to stakeholders of non-data science experts
Be creative and motivated team player with strong communication and presentation skills in English. Mandarin is a plus.
Be willing to travel up to 10%"
2017-12-14 09:04:39.792669,ec82009eb026aba4,Data Scientist / Computational Scientist,Cluster Technology Limited,Hong Kong,,"ClusterTech Limited is committed to providing value to clients through advanced computing technologies including Cloud, High Performance Computing, Big Data and Heterogeneous Computing. We provide a comprehensive range of services and products to solve problems in massive data processing, large-scale computing, in-depth analysis, artificial intelligence, and uninterrupted service. Our business areas include financial engineering (investment analysis, risk management, derivatives pricing, etc.), business intelligence (sales forecasting, customer management, inventory management, etc.), environmental science (weather forecast, heavy rain and turbulence forecasting, analysis and prediction of pollution, etc.), smart city (information gathering, information analysis, optimisation and management), and internet applications (massive image processing, video storage and delivery). We also provide public cloud, private cloud and hybrid cloud solutions for businesses of all sizes."
2017-12-14 09:04:38.276482,9d0ba18b62dfd786,Data Scientist / Data Analyst,GoGo Van,Hong Kong,,"What you'll be doing:
Create key insights and recommendations through quantitative analysis.

Develop tools for tracking, analyzing and reporting data from multiple sources and for diverse business needs.

Provide recommendations to the management and product team.

Build automated models and visualizations tools to uncover patterns, optimize service offering and improve business model.

Guide, oversee and interpret experiments.

What we're looking for:
Prior experience working with data.

Strong quantitative or engineering background.

Ability to code (preferably Python).

Good knowledge of SQL.

Familiarity with tools and libraries for data analysis.

Fast learner, enjoying solving problems using cutting edge technology.

Good communication skills.

Awesome if you have those:
Interest in logistics problems and geographic data.

Experience in machine learning or operational research.

Data visualization (knowledge of Javascript and libraries like d3.js is an advantage).

Ready to be part of the team? Apply for this position by submitting your CV to [email redacted, apply via Jobable]

GOGOVAN does not accept unsolicited resumes, CVs or applications from third party staffing or recruitment agencies. All unsolicited submissions will be considered free referrals."
2017-12-14 09:04:21.695133,ab794b2879313f04,Junior Data Scientist,ESD Services Limited (ESDlife),"Hung Hom, Kowloon",19 days ago,"You will:
"
2017-12-14 09:04:21.826108,96559f237e185481,Data Scientist - Retail Banking and Wealth Management,HSBC,"Central, Hong Kong Island",23 days ago,"Some careers open more doors than others.
"
2017-12-14 09:04:21.979081,9bf4b13e206e7fb4,"Associate/Analyst, Data Analytics, Audit",DBS Bank,Hong Kong,9 days ago,"DBS. Living, Breathing Asia.
"
2017-12-14 09:04:22.114233,ed6405453ccde459,Data Scientist,Swiss Re,Hong Kong,30+ days ago,"We are seeking for a motivated Data Scientist who has a passion for technology to join our highly skilled global team. You will contribute in establishing and developing analytics services in Swiss Re's APAC region - focusing in modelling and prototyping - in tight collaboration with internal business experts and clients. The ideal candidate has a solid background in computer science/engineering, computational linguistics or information science and possesses working experience in at least one (and ideally a combination) of the following domains: data & text mining, machine learning and information visualisation. Key Tasks • Apply analytical methods and algorithms to build data products that streamline the process from data collection to insight generation. • Foster new data-driven approaches to generate business insight in order to address unanswered business problems in a proactive way. • Validate, interpret and present data findings to both an expert and non-expert audience. • Assess analytics scenarios by means of functional prototypes or pilot solutions. • Contribute in an agile team of data scientists to deploy data-driven solutions for various Insurance and Reinsurance business opportunities (i.e., ad-hoc analysis request as well as business projects). • Build-up sustainable relationship with key business experts & clients as well as IT professionals to become a trusted partner for the field of data analytics.


About the team


The Digital & Smart Analytics unit supports Swiss Re's business functions in generating insights from structured and unstructured data for their business and strategic initiatives (e.g., Product Development, InsureTech, Accelerators, Digital Analytics Catalyst). A team of professionals in data & text mining and visual analytics provide services in three key areas: • Analytics Consulting: In collaboration with business teams identifying the relevant business opportunities and defining the business case. • Analytics Delivery (Modelling & Prototyping): Defining the most appropriate analytics method and data. Validating analytics scenarios by means of prototypes or pilot solutions. • Analytics Solution Enabling: Implementing, enhancing and maintaining analytics solutions to solve business issues


About You


Essentials • Master Study/PhD (completed or near completion) in computer science, computational linguistics or information science (or equivalent). • Knowledge and experience in the area of information retrieval, natural language processing, data analytics and information visualisation. • Sound analytical & conceptual skills to understand key business needs and apply existing and novel analytics solutions to solve specific business problems. • Good knowledge in a combination of analytic, scripting and visualisation tools for the integrated analysis of transactional, text, speech and behavioural data. • Advanced experience with statistical computing languages such as R, Matlab, SAS, SPSS. • Knowledgeable in at least one programming language such as Python, R, Java. • Experience in relational databases/SQL • Good experience with large data sets and distributed computing (Spark/Hadoop) is a plus. • Excellent verbal and written English skills, ideally multi-lingual (Mandarin is a plus). Behavioural Competences • Team player with a 'can do' attitude"
2017-12-14 09:04:22.230663,e80333fa0cadd0c9,Developer - Data Scientist,WHub,Hong Kong,30+ days ago,"Full time

Hong Kong

Developer

starting date : 2017-11-06

Terminal 1 might be able to provide a visa.

Description

We are Terminal 1 , a recruitment firm that hires software builders to both recruit and build automated recruitment tools. Our recruiters are highly skilled software engineers, product designers, data scientists, accountants, and lawyers with strong technical skills and a network in their industry.

As a Data Scientist you will be responsible for analytics pipeline from data extraction and processing to model creation and result visualization. You would work on candidate-employee matching algorithms, feature engineering and actionable insights generation.

You’ll be working closely with our engineering and product teams to ensure quality of the product and system reliability.

Requirements
Hands on experience with machine learning models using Python or R.
Good theoretical knowledge of algorithms, statistics and optimization methods.
Experience with one of the following tools: XGboost, Torch7, Tensorflow.
Data visualization skills: Tableau, ggplot, plotly, d3.js
Bachelor degree in Computer Science, Mathematics, Engineering or Physics.
Fluency in English - you’re going to be in an international and global team.
A positive attitude and good cultural fit with our team.
Additional qualification
Kaggle Expert rank or above.
Experience with distributed infrastructure tools: Apache Spark and one of Hive, Drill or Hawk
An awesome portfolio or track record in Github. We do not care about previous experience, as long as you can show us what you can do.

Salary

Equity part is negotiable.

Salary range / month : HK$ 20k-40k

WHubber factors

Startups have different perks to offer to talent. Here is their allocation of 100 points.

Flexible Role and Responsibility

Impact on Society

Compensation

Flexible hours

Flexible location

Flexible Role and Responsability20

Created on: 2017/11/03

about Terminal 1"
